No.     Time           Source                Destination           Protocol Length Info                                                            Data
    744 4.819777       18.217.1.57           192.168.38.104        HTTP     263    HTTP/1.0 200 OK  (text/html)                                    picoCTF{bfe48e8500c454d647c55a4471985e776a07b26cba64526713f43758599aa98b}

Frame 744: 263 bytes on wire (2104 bits), 263 bytes captured (2104 bits) on interface \Device\NPF_{EE54A6A6-8BD8-498A-995A-DE0B78012FBE}, id 0
Ethernet II, Src: 02:fb:68:4c:e9:41 (02:fb:68:4c:e9:41), Dst: MS-NLB-PhysServer-32_1b:c6:1a:ae:f5 (02:3b:c6:1a:ae:f5)
Internet Protocol Version 4, Src: 18.217.1.57, Dst: 192.168.38.104
Transmission Control Protocol, Src Port: 80, Dst Port: 63637, Seq: 18, Ack: 424, Len: 209
[2 Reassembled TCP Segments (226 bytes): #743(17), #744(209)]
Hypertext Transfer Protocol
Line-based text data: text/html (1 lines)

No.     Time           Source                Destination           Protocol Length Info                                                            Data
   1550 8.579695       18.217.1.57           192.168.38.104        HTTP     263    HTTP/1.0 200 OK  (text/html)                                    picoCTF{bda69bdf8f570a9aaab0e4108a0fa5f64cb26ba7d2269bb63f68af5d98b98245}

Frame 1550: 263 bytes on wire (2104 bits), 263 bytes captured (2104 bits) on interface \Device\NPF_{EE54A6A6-8BD8-498A-995A-DE0B78012FBE}, id 0
Ethernet II, Src: 02:fb:68:4c:e9:41 (02:fb:68:4c:e9:41), Dst: MS-NLB-PhysServer-32_1b:c6:1a:ae:f5 (02:3b:c6:1a:ae:f5)
Internet Protocol Version 4, Src: 18.217.1.57, Dst: 192.168.38.104
Transmission Control Protocol, Src Port: 80, Dst Port: 63639, Seq: 18, Ack: 450, Len: 209
[2 Reassembled TCP Segments (226 bytes): #1549(17), #1550(209)]
Hypertext Transfer Protocol
Line-based text data: text/html (1 lines)

No.     Time           Source                Destination           Protocol Length Info                                                            Data
   1624 9.262103       18.217.1.57           192.168.38.104        HTTP     263    HTTP/1.0 200 OK  (text/html)                                    picoCTF{fe83bcb6cfd43d3b79392f6a4232685f6ed4e7a789c2ce559cf3c1ab6adbe34b}

Frame 1624: 263 bytes on wire (2104 bits), 263 bytes captured (2104 bits) on interface \Device\NPF_{EE54A6A6-8BD8-498A-995A-DE0B78012FBE}, id 0
Ethernet II, Src: 02:fb:68:4c:e9:41 (02:fb:68:4c:e9:41), Dst: MS-NLB-PhysServer-32_1b:c6:1a:ae:f5 (02:3b:c6:1a:ae:f5)
Internet Protocol Version 4, Src: 18.217.1.57, Dst: 192.168.38.104
Transmission Control Protocol, Src Port: 80, Dst Port: 63642, Seq: 18, Ack: 450, Len: 209
[2 Reassembled TCP Segments (226 bytes): #1623(17), #1624(209)]
Hypertext Transfer Protocol
Line-based text data: text/html (1 lines)

No.     Time           Source                Destination           Protocol Length Info                                                            Data
   1688 9.791664       18.217.1.57           192.168.38.104        HTTP     263    HTTP/1.0 200 OK  (text/html)                                    picoCTF{711d3893d90f100c15e10ef4842abeed3a830f8237c1257cd47389646da97810}

Frame 1688: 263 bytes on wire (2104 bits), 263 bytes captured (2104 bits) on interface \Device\NPF_{EE54A6A6-8BD8-498A-995A-DE0B78012FBE}, id 0
Ethernet II, Src: 02:fb:68:4c:e9:41 (02:fb:68:4c:e9:41), Dst: MS-NLB-PhysServer-32_1b:c6:1a:ae:f5 (02:3b:c6:1a:ae:f5)
Internet Protocol Version 4, Src: 18.217.1.57, Dst: 192.168.38.104
Transmission Control Protocol, Src Port: 80, Dst Port: 63643, Seq: 18, Ack: 450, Len: 209
[2 Reassembled TCP Segments (226 bytes): #1687(17), #1688(209)]
Hypertext Transfer Protocol
Line-based text data: text/html (1 lines)

No.     Time           Source                Destination           Protocol Length Info                                                            Data
   1770 10.294677      18.217.1.57           192.168.38.104        HTTP     263    HTTP/1.0 200 OK  (text/html)                                    picoCTF{3cf1e22d489fcfb6bb312a34f46c8699989ed043406134331452d11ce73cd59e}

Frame 1770: 263 bytes on wire (2104 bits), 263 bytes captured (2104 bits) on interface \Device\NPF_{EE54A6A6-8BD8-498A-995A-DE0B78012FBE}, id 0
Ethernet II, Src: 02:fb:68:4c:e9:41 (02:fb:68:4c:e9:41), Dst: MS-NLB-PhysServer-32_1b:c6:1a:ae:f5 (02:3b:c6:1a:ae:f5)
Internet Protocol Version 4, Src: 18.217.1.57, Dst: 192.168.38.104
Transmission Control Protocol, Src Port: 80, Dst Port: 63644, Seq: 18, Ack: 450, Len: 209
[2 Reassembled TCP Segments (226 bytes): #1769(17), #1770(209)]
Hypertext Transfer Protocol
Line-based text data: text/html (1 lines)

No.     Time           Source                Destination           Protocol Length Info                                                            Data
   1905 10.786051      18.217.1.57           192.168.38.104        HTTP     263    HTTP/1.0 200 OK  (text/html)                                    picoCTF{b4cc138bb0f7f9da7e35085e349555aa6d00bdca3b021c1fe8663c0a422ce0d7}

Frame 1905: 263 bytes on wire (2104 bits), 263 bytes captured (2104 bits) on interface \Device\NPF_{EE54A6A6-8BD8-498A-995A-DE0B78012FBE}, id 0
Ethernet II, Src: 02:fb:68:4c:e9:41 (02:fb:68:4c:e9:41), Dst: MS-NLB-PhysServer-32_1b:c6:1a:ae:f5 (02:3b:c6:1a:ae:f5)
Internet Protocol Version 4, Src: 18.217.1.57, Dst: 192.168.38.104
Transmission Control Protocol, Src Port: 80, Dst Port: 63646, Seq: 18, Ack: 450, Len: 209
[2 Reassembled TCP Segments (226 bytes): #1904(17), #1905(209)]
Hypertext Transfer Protocol
Line-based text data: text/html (1 lines)

No.     Time           Source                Destination           Protocol Length Info                                                            Data
   1963 11.290115      18.217.1.57           192.168.38.104        HTTP     263    HTTP/1.0 200 OK  (text/html)                                    picoCTF{41b8a1a796bd8d202016f75bc5b38889e9ea06007e6b22fc856d380fb7573133}

Frame 1963: 263 bytes on wire (2104 bits), 263 bytes captured (2104 bits) on interface \Device\NPF_{EE54A6A6-8BD8-498A-995A-DE0B78012FBE}, id 0
Ethernet II, Src: 02:fb:68:4c:e9:41 (02:fb:68:4c:e9:41), Dst: MS-NLB-PhysServer-32_1b:c6:1a:ae:f5 (02:3b:c6:1a:ae:f5)
Internet Protocol Version 4, Src: 18.217.1.57, Dst: 192.168.38.104
Transmission Control Protocol, Src Port: 80, Dst Port: 63647, Seq: 18, Ack: 450, Len: 209
[2 Reassembled TCP Segments (226 bytes): #1962(17), #1963(209)]
Hypertext Transfer Protocol
Line-based text data: text/html (1 lines)

No.     Time           Source                Destination           Protocol Length Info                                                            Data
   2025 11.741040      18.217.1.57           192.168.38.104        HTTP     263    HTTP/1.0 200 OK  (text/html)                                    picoCTF{9812bc4be04e6f9c803152313db3da53b3dfb799bdb05aac46fa0dd0045d2fc2}

Frame 2025: 263 bytes on wire (2104 bits), 263 bytes captured (2104 bits) on interface \Device\NPF_{EE54A6A6-8BD8-498A-995A-DE0B78012FBE}, id 0
Ethernet II, Src: 02:fb:68:4c:e9:41 (02:fb:68:4c:e9:41), Dst: MS-NLB-PhysServer-32_1b:c6:1a:ae:f5 (02:3b:c6:1a:ae:f5)
Internet Protocol Version 4, Src: 18.217.1.57, Dst: 192.168.38.104
Transmission Control Protocol, Src Port: 80, Dst Port: 63648, Seq: 18, Ack: 450, Len: 209
[2 Reassembled TCP Segments (226 bytes): #2024(17), #2025(209)]
Hypertext Transfer Protocol
Line-based text data: text/html (1 lines)

No.     Time           Source                Destination           Protocol Length Info                                                            Data
   2067 12.156371      18.217.1.57           192.168.38.104        HTTP     263    HTTP/1.0 200 OK  (text/html)                                    picoCTF{64cf3ede3736a340fdf2954be5151ce53bec291c5e48cbccb44faa529946e249}

Frame 2067: 263 bytes on wire (2104 bits), 263 bytes captured (2104 bits) on interface \Device\NPF_{EE54A6A6-8BD8-498A-995A-DE0B78012FBE}, id 0
Ethernet II, Src: 02:fb:68:4c:e9:41 (02:fb:68:4c:e9:41), Dst: MS-NLB-PhysServer-32_1b:c6:1a:ae:f5 (02:3b:c6:1a:ae:f5)
Internet Protocol Version 4, Src: 18.217.1.57, Dst: 192.168.38.104
Transmission Control Protocol, Src Port: 80, Dst Port: 63649, Seq: 18, Ack: 450, Len: 209
[2 Reassembled TCP Segments (226 bytes): #2066(17), #2067(209)]
Hypertext Transfer Protocol
Line-based text data: text/html (1 lines)

No.     Time           Source                Destination           Protocol Length Info                                                            Data
   2176 12.533576      18.217.1.57           192.168.38.104        HTTP     263    HTTP/1.0 200 OK  (text/html)                                    picoCTF{c50d259a4e172fcb2eddbabeebd272473e4882b76c9efcd12c03ac04429d884a}

Frame 2176: 263 bytes on wire (2104 bits), 263 bytes captured (2104 bits) on interface \Device\NPF_{EE54A6A6-8BD8-498A-995A-DE0B78012FBE}, id 0
Ethernet II, Src: 02:fb:68:4c:e9:41 (02:fb:68:4c:e9:41), Dst: MS-NLB-PhysServer-32_1b:c6:1a:ae:f5 (02:3b:c6:1a:ae:f5)
Internet Protocol Version 4, Src: 18.217.1.57, Dst: 192.168.38.104
Transmission Control Protocol, Src Port: 80, Dst Port: 63650, Seq: 18, Ack: 450, Len: 209
[2 Reassembled TCP Segments (226 bytes): #2175(17), #2176(209)]
Hypertext Transfer Protocol
Line-based text data: text/html (1 lines)

No.     Time           Source                Destination           Protocol Length Info                                                            Data
   2237 12.927499      18.217.1.57           192.168.38.104        HTTP     263    HTTP/1.0 200 OK  (text/html)                                    picoCTF{0a024b7d39603756feafa2bbaa1603b14a99eae5dcd59f1d957f511d822c8c06}

Frame 2237: 263 bytes on wire (2104 bits), 263 bytes captured (2104 bits) on interface \Device\NPF_{EE54A6A6-8BD8-498A-995A-DE0B78012FBE}, id 0
Ethernet II, Src: 02:fb:68:4c:e9:41 (02:fb:68:4c:e9:41), Dst: MS-NLB-PhysServer-32_1b:c6:1a:ae:f5 (02:3b:c6:1a:ae:f5)
Internet Protocol Version 4, Src: 18.217.1.57, Dst: 192.168.38.104
Transmission Control Protocol, Src Port: 80, Dst Port: 63651, Seq: 18, Ack: 450, Len: 209
[2 Reassembled TCP Segments (226 bytes): #2236(17), #2237(209)]
Hypertext Transfer Protocol
Line-based text data: text/html (1 lines)

No.     Time           Source                Destination           Protocol Length Info                                                            Data
   2289 13.327399      18.217.1.57           192.168.38.104        HTTP     263    HTTP/1.0 200 OK  (text/html)                                    picoCTF{97211eec9228bb247d762527bace8b3e4ec2110c8834af12aefd3c552cdc21b2}

Frame 2289: 263 bytes on wire (2104 bits), 263 bytes captured (2104 bits) on interface \Device\NPF_{EE54A6A6-8BD8-498A-995A-DE0B78012FBE}, id 0
Ethernet II, Src: 02:fb:68:4c:e9:41 (02:fb:68:4c:e9:41), Dst: MS-NLB-PhysServer-32_1b:c6:1a:ae:f5 (02:3b:c6:1a:ae:f5)
Internet Protocol Version 4, Src: 18.217.1.57, Dst: 192.168.38.104
Transmission Control Protocol, Src Port: 80, Dst Port: 63652, Seq: 18, Ack: 450, Len: 209
[2 Reassembled TCP Segments (226 bytes): #2288(17), #2289(209)]
Hypertext Transfer Protocol
Line-based text data: text/html (1 lines)

No.     Time           Source                Destination           Protocol Length Info                                                            Data
   2345 13.691088      18.217.1.57           192.168.38.104        HTTP     263    HTTP/1.0 200 OK  (text/html)                                    picoCTF{29679910c47d8afc737a1c21d7bf758cd3d81001bdbeec8c6f81a6ad88fdc279}

Frame 2345: 263 bytes on wire (2104 bits), 263 bytes captured (2104 bits) on interface \Device\NPF_{EE54A6A6-8BD8-498A-995A-DE0B78012FBE}, id 0
Ethernet II, Src: 02:fb:68:4c:e9:41 (02:fb:68:4c:e9:41), Dst: MS-NLB-PhysServer-32_1b:c6:1a:ae:f5 (02:3b:c6:1a:ae:f5)
Internet Protocol Version 4, Src: 18.217.1.57, Dst: 192.168.38.104
Transmission Control Protocol, Src Port: 80, Dst Port: 63653, Seq: 18, Ack: 450, Len: 209
[2 Reassembled TCP Segments (226 bytes): #2344(17), #2345(209)]
Hypertext Transfer Protocol
Line-based text data: text/html (1 lines)

No.     Time           Source                Destination           Protocol Length Info                                                            Data
   2389 14.063836      18.217.1.57           192.168.38.104        HTTP     263    HTTP/1.0 200 OK  (text/html)                                    picoCTF{996979e9540be0fe9320e80eb6336047f8140a80830700907b99741310acf08f}

Frame 2389: 263 bytes on wire (2104 bits), 263 bytes captured (2104 bits) on interface \Device\NPF_{EE54A6A6-8BD8-498A-995A-DE0B78012FBE}, id 0
Ethernet II, Src: 02:fb:68:4c:e9:41 (02:fb:68:4c:e9:41), Dst: MS-NLB-PhysServer-32_1b:c6:1a:ae:f5 (02:3b:c6:1a:ae:f5)
Internet Protocol Version 4, Src: 18.217.1.57, Dst: 192.168.38.104
Transmission Control Protocol, Src Port: 80, Dst Port: 63654, Seq: 18, Ack: 450, Len: 209
[2 Reassembled TCP Segments (226 bytes): #2388(17), #2389(209)]
Hypertext Transfer Protocol
Line-based text data: text/html (1 lines)

No.     Time           Source                Destination           Protocol Length Info                                                            Data
   2434 14.408530      18.217.1.57           192.168.38.104        HTTP     263    HTTP/1.0 200 OK  (text/html)                                    picoCTF{8b272a18c1005c95a420d4a0df426cb8441d29eb96210493a96fa25ac5e657aa}

Frame 2434: 263 bytes on wire (2104 bits), 263 bytes captured (2104 bits) on interface \Device\NPF_{EE54A6A6-8BD8-498A-995A-DE0B78012FBE}, id 0
Ethernet II, Src: 02:fb:68:4c:e9:41 (02:fb:68:4c:e9:41), Dst: MS-NLB-PhysServer-32_1b:c6:1a:ae:f5 (02:3b:c6:1a:ae:f5)
Internet Protocol Version 4, Src: 18.217.1.57, Dst: 192.168.38.104
Transmission Control Protocol, Src Port: 80, Dst Port: 63655, Seq: 18, Ack: 450, Len: 209
[2 Reassembled TCP Segments (226 bytes): #2433(17), #2434(209)]
Hypertext Transfer Protocol
Line-based text data: text/html (1 lines)

No.     Time           Source                Destination           Protocol Length Info                                                            Data
   2865 14.744385      18.217.1.57           192.168.38.104        HTTP     263    HTTP/1.0 200 OK  (text/html)                                    picoCTF{e1d0a752dc71121200f4bcb1b8cc2e03e84488df229b82196afbe0045ef025c4}

Frame 2865: 263 bytes on wire (2104 bits), 263 bytes captured (2104 bits) on interface \Device\NPF_{EE54A6A6-8BD8-498A-995A-DE0B78012FBE}, id 0
Ethernet II, Src: 02:fb:68:4c:e9:41 (02:fb:68:4c:e9:41), Dst: MS-NLB-PhysServer-32_1b:c6:1a:ae:f5 (02:3b:c6:1a:ae:f5)
Internet Protocol Version 4, Src: 18.217.1.57, Dst: 192.168.38.104
Transmission Control Protocol, Src Port: 80, Dst Port: 63656, Seq: 18, Ack: 450, Len: 209
[2 Reassembled TCP Segments (226 bytes): #2864(17), #2865(209)]
Hypertext Transfer Protocol
Line-based text data: text/html (1 lines)

No.     Time           Source                Destination           Protocol Length Info                                                            Data
   2913 15.080336      18.217.1.57           192.168.38.104        HTTP     263    HTTP/1.0 200 OK  (text/html)                                    picoCTF{0ba511844a2ab38fe0709bcdb2b8bdfeb37a0b466dc902e92062db4c2b3f455c}

Frame 2913: 263 bytes on wire (2104 bits), 263 bytes captured (2104 bits) on interface \Device\NPF_{EE54A6A6-8BD8-498A-995A-DE0B78012FBE}, id 0
Ethernet II, Src: 02:fb:68:4c:e9:41 (02:fb:68:4c:e9:41), Dst: MS-NLB-PhysServer-32_1b:c6:1a:ae:f5 (02:3b:c6:1a:ae:f5)
Internet Protocol Version 4, Src: 18.217.1.57, Dst: 192.168.38.104
Transmission Control Protocol, Src Port: 80, Dst Port: 63659, Seq: 18, Ack: 450, Len: 209
[2 Reassembled TCP Segments (226 bytes): #2912(17), #2913(209)]
Hypertext Transfer Protocol
Line-based text data: text/html (1 lines)

No.     Time           Source                Destination           Protocol Length Info                                                            Data
   2962 15.355274      18.217.1.57           192.168.38.104        HTTP     263    HTTP/1.0 200 OK  (text/html)                                    picoCTF{dadda48e855421e14597ffc727943b57efd8c9a15d10bfd491f0390659162fb1}

Frame 2962: 263 bytes on wire (2104 bits), 263 bytes captured (2104 bits) on interface \Device\NPF_{EE54A6A6-8BD8-498A-995A-DE0B78012FBE}, id 0
Ethernet II, Src: 02:fb:68:4c:e9:41 (02:fb:68:4c:e9:41), Dst: MS-NLB-PhysServer-32_1b:c6:1a:ae:f5 (02:3b:c6:1a:ae:f5)
Internet Protocol Version 4, Src: 18.217.1.57, Dst: 192.168.38.104
Transmission Control Protocol, Src Port: 80, Dst Port: 63660, Seq: 18, Ack: 450, Len: 209
[2 Reassembled TCP Segments (226 bytes): #2961(17), #2962(209)]
Hypertext Transfer Protocol
Line-based text data: text/html (1 lines)

No.     Time           Source                Destination           Protocol Length Info                                                            Data
   2991 15.513044      18.217.1.57           192.168.38.104        HTTP     263    HTTP/1.0 200 OK  (text/html)                                    picoCTF{f4dd87795395c74f3083f8caa4ec22d1531281554a6003d1c47c5f0370984ab6}

Frame 2991: 263 bytes on wire (2104 bits), 263 bytes captured (2104 bits) on interface \Device\NPF_{EE54A6A6-8BD8-498A-995A-DE0B78012FBE}, id 0
Ethernet II, Src: 02:fb:68:4c:e9:41 (02:fb:68:4c:e9:41), Dst: MS-NLB-PhysServer-32_1b:c6:1a:ae:f5 (02:3b:c6:1a:ae:f5)
Internet Protocol Version 4, Src: 18.217.1.57, Dst: 192.168.38.104
Transmission Control Protocol, Src Port: 80, Dst Port: 63661, Seq: 18, Ack: 450, Len: 209
[2 Reassembled TCP Segments (226 bytes): #2990(17), #2991(209)]
Hypertext Transfer Protocol
Line-based text data: text/html (1 lines)

No.     Time           Source                Destination           Protocol Length Info                                                            Data
   3021 15.671906      18.217.1.57           192.168.38.104        HTTP     263    HTTP/1.0 200 OK  (text/html)                                    picoCTF{0f30a584680db9e70c7e1c6ca954c2f023b77f3fd2b05bd9aeee6e00dc4da5d7}

Frame 3021: 263 bytes on wire (2104 bits), 263 bytes captured (2104 bits) on interface \Device\NPF_{EE54A6A6-8BD8-498A-995A-DE0B78012FBE}, id 0
Ethernet II, Src: 02:fb:68:4c:e9:41 (02:fb:68:4c:e9:41), Dst: MS-NLB-PhysServer-32_1b:c6:1a:ae:f5 (02:3b:c6:1a:ae:f5)
Internet Protocol Version 4, Src: 18.217.1.57, Dst: 192.168.38.104
Transmission Control Protocol, Src Port: 80, Dst Port: 63662, Seq: 18, Ack: 450, Len: 209
[2 Reassembled TCP Segments (226 bytes): #3020(17), #3021(209)]
Hypertext Transfer Protocol
Line-based text data: text/html (1 lines)

No.     Time           Source                Destination           Protocol Length Info                                                            Data
   3042 15.775861      18.217.1.57           192.168.38.104        HTTP     263    HTTP/1.0 200 OK  (text/html)                                    picoCTF{715e4d0d167e862af8825f62d3f4ff8aef20443445a06b1c68572390a2825d29}

Frame 3042: 263 bytes on wire (2104 bits), 263 bytes captured (2104 bits) on interface \Device\NPF_{EE54A6A6-8BD8-498A-995A-DE0B78012FBE}, id 0
Ethernet II, Src: 02:fb:68:4c:e9:41 (02:fb:68:4c:e9:41), Dst: MS-NLB-PhysServer-32_1b:c6:1a:ae:f5 (02:3b:c6:1a:ae:f5)
Internet Protocol Version 4, Src: 18.217.1.57, Dst: 192.168.38.104
Transmission Control Protocol, Src Port: 80, Dst Port: 63663, Seq: 18, Ack: 450, Len: 209
[2 Reassembled TCP Segments (226 bytes): #3041(17), #3042(209)]
Hypertext Transfer Protocol
Line-based text data: text/html (1 lines)

No.     Time           Source                Destination           Protocol Length Info                                                            Data
   3077 16.003997      18.217.1.57           192.168.38.104        HTTP     263    HTTP/1.0 200 OK  (text/html)                                    picoCTF{7654ee03f31576e8ed44799fc4fa5ee053d35050000502e878d1fb8022618923}

Frame 3077: 263 bytes on wire (2104 bits), 263 bytes captured (2104 bits) on interface \Device\NPF_{EE54A6A6-8BD8-498A-995A-DE0B78012FBE}, id 0
Ethernet II, Src: 02:fb:68:4c:e9:41 (02:fb:68:4c:e9:41), Dst: MS-NLB-PhysServer-32_1b:c6:1a:ae:f5 (02:3b:c6:1a:ae:f5)
Internet Protocol Version 4, Src: 18.217.1.57, Dst: 192.168.38.104
Transmission Control Protocol, Src Port: 80, Dst Port: 63664, Seq: 18, Ack: 450, Len: 209
[2 Reassembled TCP Segments (226 bytes): #3076(17), #3077(209)]
Hypertext Transfer Protocol
Line-based text data: text/html (1 lines)

No.     Time           Source                Destination           Protocol Length Info                                                            Data
   3109 16.173311      18.217.1.57           192.168.38.104        HTTP     263    HTTP/1.0 200 OK  (text/html)                                    picoCTF{068606b5faca0491d97a2b46fdca7f6f81acbd909ce691077fe77e03a3c0939a}

Frame 3109: 263 bytes on wire (2104 bits), 263 bytes captured (2104 bits) on interface \Device\NPF_{EE54A6A6-8BD8-498A-995A-DE0B78012FBE}, id 0
Ethernet II, Src: 02:fb:68:4c:e9:41 (02:fb:68:4c:e9:41), Dst: MS-NLB-PhysServer-32_1b:c6:1a:ae:f5 (02:3b:c6:1a:ae:f5)
Internet Protocol Version 4, Src: 18.217.1.57, Dst: 192.168.38.104
Transmission Control Protocol, Src Port: 80, Dst Port: 63665, Seq: 18, Ack: 450, Len: 209
[2 Reassembled TCP Segments (226 bytes): #3108(17), #3109(209)]
Hypertext Transfer Protocol
Line-based text data: text/html (1 lines)

No.     Time           Source                Destination           Protocol Length Info                                                            Data
   3131 16.325564      18.217.1.57           192.168.38.104        HTTP     263    HTTP/1.0 200 OK  (text/html)                                    picoCTF{64ab681ffed33c49b5e8ae0576e22857e9a10ae30cdbee415fb514b84aa58aea}

Frame 3131: 263 bytes on wire (2104 bits), 263 bytes captured (2104 bits) on interface \Device\NPF_{EE54A6A6-8BD8-498A-995A-DE0B78012FBE}, id 0
Ethernet II, Src: 02:fb:68:4c:e9:41 (02:fb:68:4c:e9:41), Dst: MS-NLB-PhysServer-32_1b:c6:1a:ae:f5 (02:3b:c6:1a:ae:f5)
Internet Protocol Version 4, Src: 18.217.1.57, Dst: 192.168.38.104
Transmission Control Protocol, Src Port: 80, Dst Port: 63666, Seq: 18, Ack: 450, Len: 209
[2 Reassembled TCP Segments (226 bytes): #3130(17), #3131(209)]
Hypertext Transfer Protocol
Line-based text data: text/html (1 lines)

No.     Time           Source                Destination           Protocol Length Info                                                            Data
   3149 16.467174      18.217.1.57           192.168.38.104        HTTP     263    HTTP/1.0 200 OK  (text/html)                                    picoCTF{8ae3995e726f8f2c3724e2e0522f038aba6649facd378d8965c648233d79a252}

Frame 3149: 263 bytes on wire (2104 bits), 263 bytes captured (2104 bits) on interface \Device\NPF_{EE54A6A6-8BD8-498A-995A-DE0B78012FBE}, id 0
Ethernet II, Src: 02:fb:68:4c:e9:41 (02:fb:68:4c:e9:41), Dst: MS-NLB-PhysServer-32_1b:c6:1a:ae:f5 (02:3b:c6:1a:ae:f5)
Internet Protocol Version 4, Src: 18.217.1.57, Dst: 192.168.38.104
Transmission Control Protocol, Src Port: 80, Dst Port: 63667, Seq: 18, Ack: 450, Len: 209
[2 Reassembled TCP Segments (226 bytes): #3148(17), #3149(209)]
Hypertext Transfer Protocol
Line-based text data: text/html (1 lines)

No.     Time           Source                Destination           Protocol Length Info                                                            Data
   3169 16.625831      18.217.1.57           192.168.38.104        HTTP     263    HTTP/1.0 200 OK  (text/html)                                    picoCTF{1c125d267b5811cd25cca2d517e022270aa60f3c8461f4097c685bcca637a6a9}

Frame 3169: 263 bytes on wire (2104 bits), 263 bytes captured (2104 bits) on interface \Device\NPF_{EE54A6A6-8BD8-498A-995A-DE0B78012FBE}, id 0
Ethernet II, Src: 02:fb:68:4c:e9:41 (02:fb:68:4c:e9:41), Dst: MS-NLB-PhysServer-32_1b:c6:1a:ae:f5 (02:3b:c6:1a:ae:f5)
Internet Protocol Version 4, Src: 18.217.1.57, Dst: 192.168.38.104
Transmission Control Protocol, Src Port: 80, Dst Port: 63668, Seq: 18, Ack: 450, Len: 209
[2 Reassembled TCP Segments (226 bytes): #3168(17), #3169(209)]
Hypertext Transfer Protocol
Line-based text data: text/html (1 lines)

No.     Time           Source                Destination           Protocol Length Info                                                            Data
   3191 16.763012      18.217.1.57           192.168.38.104        HTTP     263    HTTP/1.0 200 OK  (text/html)                                    picoCTF{824c298d14e1fe369df991af72ab0725d2e7c7d05b9655486873ccc467f4bd6b}

Frame 3191: 263 bytes on wire (2104 bits), 263 bytes captured (2104 bits) on interface \Device\NPF_{EE54A6A6-8BD8-498A-995A-DE0B78012FBE}, id 0
Ethernet II, Src: 02:fb:68:4c:e9:41 (02:fb:68:4c:e9:41), Dst: MS-NLB-PhysServer-32_1b:c6:1a:ae:f5 (02:3b:c6:1a:ae:f5)
Internet Protocol Version 4, Src: 18.217.1.57, Dst: 192.168.38.104
Transmission Control Protocol, Src Port: 80, Dst Port: 63669, Seq: 18, Ack: 450, Len: 209
[2 Reassembled TCP Segments (226 bytes): #3190(17), #3191(209)]
Hypertext Transfer Protocol
Line-based text data: text/html (1 lines)

No.     Time           Source                Destination           Protocol Length Info                                                            Data
   3217 16.919628      18.217.1.57           192.168.38.104        HTTP     263    HTTP/1.0 200 OK  (text/html)                                    picoCTF{e1d8dd1b73d5fd7704a16c924ddee69dc6bf9beef14cc3a10142704b81f0fa07}

Frame 3217: 263 bytes on wire (2104 bits), 263 bytes captured (2104 bits) on interface \Device\NPF_{EE54A6A6-8BD8-498A-995A-DE0B78012FBE}, id 0
Ethernet II, Src: 02:fb:68:4c:e9:41 (02:fb:68:4c:e9:41), Dst: MS-NLB-PhysServer-32_1b:c6:1a:ae:f5 (02:3b:c6:1a:ae:f5)
Internet Protocol Version 4, Src: 18.217.1.57, Dst: 192.168.38.104
Transmission Control Protocol, Src Port: 80, Dst Port: 63670, Seq: 18, Ack: 450, Len: 209
[2 Reassembled TCP Segments (226 bytes): #3216(17), #3217(209)]
Hypertext Transfer Protocol
Line-based text data: text/html (1 lines)

No.     Time           Source                Destination           Protocol Length Info                                                            Data
   3241 17.081046      18.217.1.57           192.168.38.104        HTTP     263    HTTP/1.0 200 OK  (text/html)                                    picoCTF{82d260fe0670d551347b164c54183d996c52ebeebb1ccfcc2c2ebb91268dc944}

Frame 3241: 263 bytes on wire (2104 bits), 263 bytes captured (2104 bits) on interface \Device\NPF_{EE54A6A6-8BD8-498A-995A-DE0B78012FBE}, id 0
Ethernet II, Src: 02:fb:68:4c:e9:41 (02:fb:68:4c:e9:41), Dst: MS-NLB-PhysServer-32_1b:c6:1a:ae:f5 (02:3b:c6:1a:ae:f5)
Internet Protocol Version 4, Src: 18.217.1.57, Dst: 192.168.38.104
Transmission Control Protocol, Src Port: 80, Dst Port: 63671, Seq: 18, Ack: 450, Len: 209
[2 Reassembled TCP Segments (226 bytes): #3240(17), #3241(209)]
Hypertext Transfer Protocol
Line-based text data: text/html (1 lines)

No.     Time           Source                Destination           Protocol Length Info                                                            Data
   3268 17.224293      18.217.1.57           192.168.38.104        HTTP     263    HTTP/1.0 200 OK  (text/html)                                    picoCTF{74876fc61ebc9c902f8983979cd4c21206c69a23f0dcc0817e150dd75e446838}

Frame 3268: 263 bytes on wire (2104 bits), 263 bytes captured (2104 bits) on interface \Device\NPF_{EE54A6A6-8BD8-498A-995A-DE0B78012FBE}, id 0
Ethernet II, Src: 02:fb:68:4c:e9:41 (02:fb:68:4c:e9:41), Dst: MS-NLB-PhysServer-32_1b:c6:1a:ae:f5 (02:3b:c6:1a:ae:f5)
Internet Protocol Version 4, Src: 18.217.1.57, Dst: 192.168.38.104
Transmission Control Protocol, Src Port: 80, Dst Port: 63672, Seq: 18, Ack: 450, Len: 209
[2 Reassembled TCP Segments (226 bytes): #3267(17), #3268(209)]
Hypertext Transfer Protocol
Line-based text data: text/html (1 lines)

No.     Time           Source                Destination           Protocol Length Info                                                            Data
   3291 17.363195      18.217.1.57           192.168.38.104        HTTP     263    HTTP/1.0 200 OK  (text/html)                                    picoCTF{49c52d1f30973f90716bbcbe3633e11cf70b9a31ed785871ccb80473302a59db}

Frame 3291: 263 bytes on wire (2104 bits), 263 bytes captured (2104 bits) on interface \Device\NPF_{EE54A6A6-8BD8-498A-995A-DE0B78012FBE}, id 0
Ethernet II, Src: 02:fb:68:4c:e9:41 (02:fb:68:4c:e9:41), Dst: MS-NLB-PhysServer-32_1b:c6:1a:ae:f5 (02:3b:c6:1a:ae:f5)
Internet Protocol Version 4, Src: 18.217.1.57, Dst: 192.168.38.104
Transmission Control Protocol, Src Port: 80, Dst Port: 63673, Seq: 18, Ack: 450, Len: 209
[2 Reassembled TCP Segments (226 bytes): #3290(17), #3291(209)]
Hypertext Transfer Protocol
Line-based text data: text/html (1 lines)

No.     Time           Source                Destination           Protocol Length Info                                                            Data
   3329 17.583888      18.217.1.57           192.168.38.104        HTTP     263    HTTP/1.0 200 OK  (text/html)                                    picoCTF{89d93dbb96a3857ac87ba0cea3c10a9e4c7b34d79b2edb463cef030d34297bd0}

Frame 3329: 263 bytes on wire (2104 bits), 263 bytes captured (2104 bits) on interface \Device\NPF_{EE54A6A6-8BD8-498A-995A-DE0B78012FBE}, id 0
Ethernet II, Src: 02:fb:68:4c:e9:41 (02:fb:68:4c:e9:41), Dst: MS-NLB-PhysServer-32_1b:c6:1a:ae:f5 (02:3b:c6:1a:ae:f5)
Internet Protocol Version 4, Src: 18.217.1.57, Dst: 192.168.38.104
Transmission Control Protocol, Src Port: 80, Dst Port: 63674, Seq: 18, Ack: 450, Len: 209
[2 Reassembled TCP Segments (226 bytes): #3328(17), #3329(209)]
Hypertext Transfer Protocol
Line-based text data: text/html (1 lines)

No.     Time           Source                Destination           Protocol Length Info                                                            Data
   3345 17.690732      18.217.1.57           192.168.38.104        HTTP     263    HTTP/1.0 200 OK  (text/html)                                    picoCTF{5ceacdce54c13a3fddfcfb225a00247304fbb15f29f9c90434383f277567992d}

Frame 3345: 263 bytes on wire (2104 bits), 263 bytes captured (2104 bits) on interface \Device\NPF_{EE54A6A6-8BD8-498A-995A-DE0B78012FBE}, id 0
Ethernet II, Src: 02:fb:68:4c:e9:41 (02:fb:68:4c:e9:41), Dst: MS-NLB-PhysServer-32_1b:c6:1a:ae:f5 (02:3b:c6:1a:ae:f5)
Internet Protocol Version 4, Src: 18.217.1.57, Dst: 192.168.38.104
Transmission Control Protocol, Src Port: 80, Dst Port: 63675, Seq: 18, Ack: 450, Len: 209
[2 Reassembled TCP Segments (226 bytes): #3344(17), #3345(209)]
Hypertext Transfer Protocol
Line-based text data: text/html (1 lines)

No.     Time           Source                Destination           Protocol Length Info                                                            Data
   3371 17.835431      18.217.1.57           192.168.38.104        HTTP     263    HTTP/1.0 200 OK  (text/html)                                    picoCTF{c22a40a43ed7034bd935805f59603a46d3a1f2d6b8e31281eb0721597b6c6d62}

Frame 3371: 263 bytes on wire (2104 bits), 263 bytes captured (2104 bits) on interface \Device\NPF_{EE54A6A6-8BD8-498A-995A-DE0B78012FBE}, id 0
Ethernet II, Src: 02:fb:68:4c:e9:41 (02:fb:68:4c:e9:41), Dst: MS-NLB-PhysServer-32_1b:c6:1a:ae:f5 (02:3b:c6:1a:ae:f5)
Internet Protocol Version 4, Src: 18.217.1.57, Dst: 192.168.38.104
Transmission Control Protocol, Src Port: 80, Dst Port: 63676, Seq: 18, Ack: 450, Len: 209
[2 Reassembled TCP Segments (226 bytes): #3370(17), #3371(209)]
Hypertext Transfer Protocol
Line-based text data: text/html (1 lines)

No.     Time           Source                Destination           Protocol Length Info                                                            Data
   3397 17.992679      18.217.1.57           192.168.38.104        HTTP     263    HTTP/1.0 200 OK  (text/html)                                    picoCTF{6071bca5da06d4f975a52357cda0cd6f0614787c1c70b1b7e1af2c7fb272d281}

Frame 3397: 263 bytes on wire (2104 bits), 263 bytes captured (2104 bits) on interface \Device\NPF_{EE54A6A6-8BD8-498A-995A-DE0B78012FBE}, id 0
Ethernet II, Src: 02:fb:68:4c:e9:41 (02:fb:68:4c:e9:41), Dst: MS-NLB-PhysServer-32_1b:c6:1a:ae:f5 (02:3b:c6:1a:ae:f5)
Internet Protocol Version 4, Src: 18.217.1.57, Dst: 192.168.38.104
Transmission Control Protocol, Src Port: 80, Dst Port: 63677, Seq: 18, Ack: 450, Len: 209
[2 Reassembled TCP Segments (226 bytes): #3396(17), #3397(209)]
Hypertext Transfer Protocol
Line-based text data: text/html (1 lines)

No.     Time           Source                Destination           Protocol Length Info                                                            Data
   3419 18.165886      18.217.1.57           192.168.38.104        HTTP     263    HTTP/1.0 200 OK  (text/html)                                    picoCTF{65a8b141f019506feea38a119988ad645bcab1a5fa8693efdf26e1fd3cb44b4c}

Frame 3419: 263 bytes on wire (2104 bits), 263 bytes captured (2104 bits) on interface \Device\NPF_{EE54A6A6-8BD8-498A-995A-DE0B78012FBE}, id 0
Ethernet II, Src: 02:fb:68:4c:e9:41 (02:fb:68:4c:e9:41), Dst: MS-NLB-PhysServer-32_1b:c6:1a:ae:f5 (02:3b:c6:1a:ae:f5)
Internet Protocol Version 4, Src: 18.217.1.57, Dst: 192.168.38.104
Transmission Control Protocol, Src Port: 80, Dst Port: 63678, Seq: 18, Ack: 450, Len: 209
[2 Reassembled TCP Segments (226 bytes): #3418(17), #3419(209)]
Hypertext Transfer Protocol
Line-based text data: text/html (1 lines)

No.     Time           Source                Destination           Protocol Length Info                                                            Data
   3439 18.313247      18.217.1.57           192.168.38.104        HTTP     263    HTTP/1.0 200 OK  (text/html)                                    picoCTF{d7f5cb78a895d3805601522b95d599cb6d2689c6a856e3fbee6aac2fca0c20f3}

Frame 3439: 263 bytes on wire (2104 bits), 263 bytes captured (2104 bits) on interface \Device\NPF_{EE54A6A6-8BD8-498A-995A-DE0B78012FBE}, id 0
Ethernet II, Src: 02:fb:68:4c:e9:41 (02:fb:68:4c:e9:41), Dst: MS-NLB-PhysServer-32_1b:c6:1a:ae:f5 (02:3b:c6:1a:ae:f5)
Internet Protocol Version 4, Src: 18.217.1.57, Dst: 192.168.38.104
Transmission Control Protocol, Src Port: 80, Dst Port: 63679, Seq: 18, Ack: 450, Len: 209
[2 Reassembled TCP Segments (226 bytes): #3438(17), #3439(209)]
Hypertext Transfer Protocol
Line-based text data: text/html (1 lines)

No.     Time           Source                Destination           Protocol Length Info                                                            Data
   3465 18.497248      18.217.1.57           192.168.38.104        HTTP     263    HTTP/1.0 200 OK  (text/html)                                    picoCTF{739bb0f0aa17331819a0e942d37bfee757c8d9cd089cdfe32509027b92485213}

Frame 3465: 263 bytes on wire (2104 bits), 263 bytes captured (2104 bits) on interface \Device\NPF_{EE54A6A6-8BD8-498A-995A-DE0B78012FBE}, id 0
Ethernet II, Src: 02:fb:68:4c:e9:41 (02:fb:68:4c:e9:41), Dst: MS-NLB-PhysServer-32_1b:c6:1a:ae:f5 (02:3b:c6:1a:ae:f5)
Internet Protocol Version 4, Src: 18.217.1.57, Dst: 192.168.38.104
Transmission Control Protocol, Src Port: 80, Dst Port: 63680, Seq: 18, Ack: 450, Len: 209
[2 Reassembled TCP Segments (226 bytes): #3464(17), #3465(209)]
Hypertext Transfer Protocol
Line-based text data: text/html (1 lines)

No.     Time           Source                Destination           Protocol Length Info                                                            Data
   3489 18.615653      18.217.1.57           192.168.38.104        HTTP     263    HTTP/1.0 200 OK  (text/html)                                    picoCTF{7a891e2c4ad0da374bc15ad7ad0ee081077dd376f06152781f780c201691713d}

Frame 3489: 263 bytes on wire (2104 bits), 263 bytes captured (2104 bits) on interface \Device\NPF_{EE54A6A6-8BD8-498A-995A-DE0B78012FBE}, id 0
Ethernet II, Src: 02:fb:68:4c:e9:41 (02:fb:68:4c:e9:41), Dst: MS-NLB-PhysServer-32_1b:c6:1a:ae:f5 (02:3b:c6:1a:ae:f5)
Internet Protocol Version 4, Src: 18.217.1.57, Dst: 192.168.38.104
Transmission Control Protocol, Src Port: 80, Dst Port: 63681, Seq: 18, Ack: 450, Len: 209
[2 Reassembled TCP Segments (226 bytes): #3488(17), #3489(209)]
Hypertext Transfer Protocol
Line-based text data: text/html (1 lines)

No.     Time           Source                Destination           Protocol Length Info                                                            Data
   3541 18.762486      18.217.1.57           192.168.38.104        HTTP     263    HTTP/1.0 200 OK  (text/html)                                    picoCTF{a97d3ee943221888bd1157429e4a00ed5e9905a610e64664f7e36c7f5e0a4ef9}

Frame 3541: 263 bytes on wire (2104 bits), 263 bytes captured (2104 bits) on interface \Device\NPF_{EE54A6A6-8BD8-498A-995A-DE0B78012FBE}, id 0
Ethernet II, Src: 02:fb:68:4c:e9:41 (02:fb:68:4c:e9:41), Dst: MS-NLB-PhysServer-32_1b:c6:1a:ae:f5 (02:3b:c6:1a:ae:f5)
Internet Protocol Version 4, Src: 18.217.1.57, Dst: 192.168.38.104
Transmission Control Protocol, Src Port: 80, Dst Port: 63682, Seq: 18, Ack: 450, Len: 209
[2 Reassembled TCP Segments (226 bytes): #3540(17), #3541(209)]
Hypertext Transfer Protocol
Line-based text data: text/html (1 lines)

No.     Time           Source                Destination           Protocol Length Info                                                            Data
   3582 18.926996      18.217.1.57           192.168.38.104        HTTP     263    HTTP/1.0 200 OK  (text/html)                                    picoCTF{c38d2d74dc21bbb2e3a95b52e2354ee523379cfe4f8b348c9c5b5d7bd7cb871b}

Frame 3582: 263 bytes on wire (2104 bits), 263 bytes captured (2104 bits) on interface \Device\NPF_{EE54A6A6-8BD8-498A-995A-DE0B78012FBE}, id 0
Ethernet II, Src: 02:fb:68:4c:e9:41 (02:fb:68:4c:e9:41), Dst: MS-NLB-PhysServer-32_1b:c6:1a:ae:f5 (02:3b:c6:1a:ae:f5)
Internet Protocol Version 4, Src: 18.217.1.57, Dst: 192.168.38.104
Transmission Control Protocol, Src Port: 80, Dst Port: 63684, Seq: 18, Ack: 450, Len: 209
[2 Reassembled TCP Segments (226 bytes): #3581(17), #3582(209)]
Hypertext Transfer Protocol
Line-based text data: text/html (1 lines)

No.     Time           Source                Destination           Protocol Length Info                                                            Data
   3616 19.097025      18.217.1.57           192.168.38.104        HTTP     263    HTTP/1.0 200 OK  (text/html)                                    picoCTF{e4dc886c39a53ff118bf29041067cde48dcebb89b3dae61a8aba6187d671999a}

Frame 3616: 263 bytes on wire (2104 bits), 263 bytes captured (2104 bits) on interface \Device\NPF_{EE54A6A6-8BD8-498A-995A-DE0B78012FBE}, id 0
Ethernet II, Src: 02:fb:68:4c:e9:41 (02:fb:68:4c:e9:41), Dst: MS-NLB-PhysServer-32_1b:c6:1a:ae:f5 (02:3b:c6:1a:ae:f5)
Internet Protocol Version 4, Src: 18.217.1.57, Dst: 192.168.38.104
Transmission Control Protocol, Src Port: 80, Dst Port: 63686, Seq: 18, Ack: 450, Len: 209
[2 Reassembled TCP Segments (226 bytes): #3615(17), #3616(209)]
Hypertext Transfer Protocol
Line-based text data: text/html (1 lines)

No.     Time           Source                Destination           Protocol Length Info                                                            Data
   3644 19.256475      18.217.1.57           192.168.38.104        HTTP     263    HTTP/1.0 200 OK  (text/html)                                    picoCTF{9fbd0d18aa1abfd289ba977ae4354b821cc74591260889afba1b0b6e7763aa31}

Frame 3644: 263 bytes on wire (2104 bits), 263 bytes captured (2104 bits) on interface \Device\NPF_{EE54A6A6-8BD8-498A-995A-DE0B78012FBE}, id 0
Ethernet II, Src: 02:fb:68:4c:e9:41 (02:fb:68:4c:e9:41), Dst: MS-NLB-PhysServer-32_1b:c6:1a:ae:f5 (02:3b:c6:1a:ae:f5)
Internet Protocol Version 4, Src: 18.217.1.57, Dst: 192.168.38.104
Transmission Control Protocol, Src Port: 80, Dst Port: 63687, Seq: 18, Ack: 450, Len: 209
[2 Reassembled TCP Segments (226 bytes): #3643(17), #3644(209)]
Hypertext Transfer Protocol
Line-based text data: text/html (1 lines)

No.     Time           Source                Destination           Protocol Length Info                                                            Data
   3666 19.402064      18.217.1.57           192.168.38.104        HTTP     263    HTTP/1.0 200 OK  (text/html)                                    picoCTF{3fc0801bcd36336a2c030c6e5f452f5795be1d562e00411365fb64c6a2f688ef}

Frame 3666: 263 bytes on wire (2104 bits), 263 bytes captured (2104 bits) on interface \Device\NPF_{EE54A6A6-8BD8-498A-995A-DE0B78012FBE}, id 0
Ethernet II, Src: 02:fb:68:4c:e9:41 (02:fb:68:4c:e9:41), Dst: MS-NLB-PhysServer-32_1b:c6:1a:ae:f5 (02:3b:c6:1a:ae:f5)
Internet Protocol Version 4, Src: 18.217.1.57, Dst: 192.168.38.104
Transmission Control Protocol, Src Port: 80, Dst Port: 63688, Seq: 18, Ack: 450, Len: 209
[2 Reassembled TCP Segments (226 bytes): #3665(17), #3666(209)]
Hypertext Transfer Protocol
Line-based text data: text/html (1 lines)

No.     Time           Source                Destination           Protocol Length Info                                                            Data
   3797 19.546745      18.217.1.57           192.168.38.104        HTTP     263    HTTP/1.0 200 OK  (text/html)                                    picoCTF{4aa86643eb2ddb5709725344cd0e63e6c52e35c2e64a39f3a4a0ee7bbd5d3ade}

Frame 3797: 263 bytes on wire (2104 bits), 263 bytes captured (2104 bits) on interface \Device\NPF_{EE54A6A6-8BD8-498A-995A-DE0B78012FBE}, id 0
Ethernet II, Src: 02:fb:68:4c:e9:41 (02:fb:68:4c:e9:41), Dst: MS-NLB-PhysServer-32_1b:c6:1a:ae:f5 (02:3b:c6:1a:ae:f5)
Internet Protocol Version 4, Src: 18.217.1.57, Dst: 192.168.38.104
Transmission Control Protocol, Src Port: 80, Dst Port: 63689, Seq: 18, Ack: 450, Len: 209
[2 Reassembled TCP Segments (226 bytes): #3796(17), #3797(209)]
Hypertext Transfer Protocol
Line-based text data: text/html (1 lines)

No.     Time           Source                Destination           Protocol Length Info                                                            Data
   3852 19.735055      18.217.1.57           192.168.38.104        HTTP     263    HTTP/1.0 200 OK  (text/html)                                    picoCTF{4af8df415d17e6df99a5efddebcb33a68c0c8bf26d481eed16b5f77675030d7f}

Frame 3852: 263 bytes on wire (2104 bits), 263 bytes captured (2104 bits) on interface \Device\NPF_{EE54A6A6-8BD8-498A-995A-DE0B78012FBE}, id 0
Ethernet II, Src: 02:fb:68:4c:e9:41 (02:fb:68:4c:e9:41), Dst: MS-NLB-PhysServer-32_1b:c6:1a:ae:f5 (02:3b:c6:1a:ae:f5)
Internet Protocol Version 4, Src: 18.217.1.57, Dst: 192.168.38.104
Transmission Control Protocol, Src Port: 80, Dst Port: 63690, Seq: 18, Ack: 450, Len: 209
[2 Reassembled TCP Segments (226 bytes): #3851(17), #3852(209)]
Hypertext Transfer Protocol
Line-based text data: text/html (1 lines)

No.     Time           Source                Destination           Protocol Length Info                                                            Data
   3884 19.885396      18.217.1.57           192.168.38.104        HTTP     263    HTTP/1.0 200 OK  (text/html)                                    picoCTF{e4f52a0d2a924906ac102a32c52ab9128bf9cd6e5294518ad3ed6748f853b0ab}

Frame 3884: 263 bytes on wire (2104 bits), 263 bytes captured (2104 bits) on interface \Device\NPF_{EE54A6A6-8BD8-498A-995A-DE0B78012FBE}, id 0
Ethernet II, Src: 02:fb:68:4c:e9:41 (02:fb:68:4c:e9:41), Dst: MS-NLB-PhysServer-32_1b:c6:1a:ae:f5 (02:3b:c6:1a:ae:f5)
Internet Protocol Version 4, Src: 18.217.1.57, Dst: 192.168.38.104
Transmission Control Protocol, Src Port: 80, Dst Port: 63691, Seq: 18, Ack: 450, Len: 209
[2 Reassembled TCP Segments (226 bytes): #3883(17), #3884(209)]
Hypertext Transfer Protocol
Line-based text data: text/html (1 lines)

No.     Time           Source                Destination           Protocol Length Info                                                            Data
   3910 20.047870      18.217.1.57           192.168.38.104        HTTP     263    HTTP/1.0 200 OK  (text/html)                                    picoCTF{cc104e74a9f50164ee5652d168ef38a21b7a2d5e3196062e669e3a2705f1a0d3}

Frame 3910: 263 bytes on wire (2104 bits), 263 bytes captured (2104 bits) on interface \Device\NPF_{EE54A6A6-8BD8-498A-995A-DE0B78012FBE}, id 0
Ethernet II, Src: 02:fb:68:4c:e9:41 (02:fb:68:4c:e9:41), Dst: MS-NLB-PhysServer-32_1b:c6:1a:ae:f5 (02:3b:c6:1a:ae:f5)
Internet Protocol Version 4, Src: 18.217.1.57, Dst: 192.168.38.104
Transmission Control Protocol, Src Port: 80, Dst Port: 63692, Seq: 18, Ack: 450, Len: 209
[2 Reassembled TCP Segments (226 bytes): #3909(17), #3910(209)]
Hypertext Transfer Protocol
Line-based text data: text/html (1 lines)

No.     Time           Source                Destination           Protocol Length Info                                                            Data
   3953 20.198871      18.217.1.57           192.168.38.104        HTTP     263    HTTP/1.0 200 OK  (text/html)                                    picoCTF{2aac620b0bdd2e6946d62c5d232ca32ba1f5a9d8ec82c060778b54ffeb8fbd1f}

Frame 3953: 263 bytes on wire (2104 bits), 263 bytes captured (2104 bits) on interface \Device\NPF_{EE54A6A6-8BD8-498A-995A-DE0B78012FBE}, id 0
Ethernet II, Src: 02:fb:68:4c:e9:41 (02:fb:68:4c:e9:41), Dst: MS-NLB-PhysServer-32_1b:c6:1a:ae:f5 (02:3b:c6:1a:ae:f5)
Internet Protocol Version 4, Src: 18.217.1.57, Dst: 192.168.38.104
Transmission Control Protocol, Src Port: 80, Dst Port: 63693, Seq: 18, Ack: 450, Len: 209
[2 Reassembled TCP Segments (226 bytes): #3952(17), #3953(209)]
Hypertext Transfer Protocol
Line-based text data: text/html (1 lines)

No.     Time           Source                Destination           Protocol Length Info                                                            Data
   3978 20.347379      18.217.1.57           192.168.38.104        HTTP     263    HTTP/1.0 200 OK  (text/html)                                    picoCTF{4e55be07159def207afc142954f5673a0651d5f32f5f4090fb774d960628e352}

Frame 3978: 263 bytes on wire (2104 bits), 263 bytes captured (2104 bits) on interface \Device\NPF_{EE54A6A6-8BD8-498A-995A-DE0B78012FBE}, id 0
Ethernet II, Src: 02:fb:68:4c:e9:41 (02:fb:68:4c:e9:41), Dst: MS-NLB-PhysServer-32_1b:c6:1a:ae:f5 (02:3b:c6:1a:ae:f5)
Internet Protocol Version 4, Src: 18.217.1.57, Dst: 192.168.38.104
Transmission Control Protocol, Src Port: 80, Dst Port: 63695, Seq: 18, Ack: 450, Len: 209
[2 Reassembled TCP Segments (226 bytes): #3977(17), #3978(209)]
Hypertext Transfer Protocol
Line-based text data: text/html (1 lines)

No.     Time           Source                Destination           Protocol Length Info                                                            Data
   4010 20.523208      18.217.1.57           192.168.38.104        HTTP     263    HTTP/1.0 200 OK  (text/html)                                    picoCTF{983e5e2703a132a49479e438bfba15ee5d02345b03d410b8163b685973937da7}

Frame 4010: 263 bytes on wire (2104 bits), 263 bytes captured (2104 bits) on interface \Device\NPF_{EE54A6A6-8BD8-498A-995A-DE0B78012FBE}, id 0
Ethernet II, Src: 02:fb:68:4c:e9:41 (02:fb:68:4c:e9:41), Dst: MS-NLB-PhysServer-32_1b:c6:1a:ae:f5 (02:3b:c6:1a:ae:f5)
Internet Protocol Version 4, Src: 18.217.1.57, Dst: 192.168.38.104
Transmission Control Protocol, Src Port: 80, Dst Port: 63696, Seq: 18, Ack: 450, Len: 209
[2 Reassembled TCP Segments (226 bytes): #4009(17), #4010(209)]
Hypertext Transfer Protocol
Line-based text data: text/html (1 lines)

No.     Time           Source                Destination           Protocol Length Info                                                            Data
   4035 20.691743      18.217.1.57           192.168.38.104        HTTP     263    HTTP/1.0 200 OK  (text/html)                                    picoCTF{d342a46e8179de9941720c5e0eeac0d0fae9d3014d2ddcf531a7865a997b00e5}

Frame 4035: 263 bytes on wire (2104 bits), 263 bytes captured (2104 bits) on interface \Device\NPF_{EE54A6A6-8BD8-498A-995A-DE0B78012FBE}, id 0
Ethernet II, Src: 02:fb:68:4c:e9:41 (02:fb:68:4c:e9:41), Dst: MS-NLB-PhysServer-32_1b:c6:1a:ae:f5 (02:3b:c6:1a:ae:f5)
Internet Protocol Version 4, Src: 18.217.1.57, Dst: 192.168.38.104
Transmission Control Protocol, Src Port: 80, Dst Port: 63697, Seq: 18, Ack: 450, Len: 209
[2 Reassembled TCP Segments (226 bytes): #4034(17), #4035(209)]
Hypertext Transfer Protocol
Line-based text data: text/html (1 lines)

No.     Time           Source                Destination           Protocol Length Info                                                            Data
   4066 20.857776      18.217.1.57           192.168.38.104        HTTP     263    HTTP/1.0 200 OK  (text/html)                                    picoCTF{2133904cfe757bc6c68c3e5f3749b37d67d7fa6ffb2768410be593d3fe8c4bd4}

Frame 4066: 263 bytes on wire (2104 bits), 263 bytes captured (2104 bits) on interface \Device\NPF_{EE54A6A6-8BD8-498A-995A-DE0B78012FBE}, id 0
Ethernet II, Src: 02:fb:68:4c:e9:41 (02:fb:68:4c:e9:41), Dst: MS-NLB-PhysServer-32_1b:c6:1a:ae:f5 (02:3b:c6:1a:ae:f5)
Internet Protocol Version 4, Src: 18.217.1.57, Dst: 192.168.38.104
Transmission Control Protocol, Src Port: 80, Dst Port: 63698, Seq: 18, Ack: 450, Len: 209
[2 Reassembled TCP Segments (226 bytes): #4065(17), #4066(209)]
Hypertext Transfer Protocol
Line-based text data: text/html (1 lines)

No.     Time           Source                Destination           Protocol Length Info                                                            Data
   4090 21.007648      18.217.1.57           192.168.38.104        HTTP     263    HTTP/1.0 200 OK  (text/html)                                    picoCTF{29b726b9a57d176e1487d159474ee7e6508b66c05c526a00c942a8cebb6bb496}

Frame 4090: 263 bytes on wire (2104 bits), 263 bytes captured (2104 bits) on interface \Device\NPF_{EE54A6A6-8BD8-498A-995A-DE0B78012FBE}, id 0
Ethernet II, Src: 02:fb:68:4c:e9:41 (02:fb:68:4c:e9:41), Dst: MS-NLB-PhysServer-32_1b:c6:1a:ae:f5 (02:3b:c6:1a:ae:f5)
Internet Protocol Version 4, Src: 18.217.1.57, Dst: 192.168.38.104
Transmission Control Protocol, Src Port: 80, Dst Port: 63699, Seq: 18, Ack: 450, Len: 209
[2 Reassembled TCP Segments (226 bytes): #4089(17), #4090(209)]
Hypertext Transfer Protocol
Line-based text data: text/html (1 lines)

No.     Time           Source                Destination           Protocol Length Info                                                            Data
   4116 21.163842      18.217.1.57           192.168.38.104        HTTP     263    HTTP/1.0 200 OK  (text/html)                                    picoCTF{7302b0dca07cd890c75e38d78d7e74d7bbf2b932f555aaf5b6754f56e778e3fc}

Frame 4116: 263 bytes on wire (2104 bits), 263 bytes captured (2104 bits) on interface \Device\NPF_{EE54A6A6-8BD8-498A-995A-DE0B78012FBE}, id 0
Ethernet II, Src: 02:fb:68:4c:e9:41 (02:fb:68:4c:e9:41), Dst: MS-NLB-PhysServer-32_1b:c6:1a:ae:f5 (02:3b:c6:1a:ae:f5)
Internet Protocol Version 4, Src: 18.217.1.57, Dst: 192.168.38.104
Transmission Control Protocol, Src Port: 80, Dst Port: 63700, Seq: 18, Ack: 450, Len: 209
[2 Reassembled TCP Segments (226 bytes): #4115(17), #4116(209)]
Hypertext Transfer Protocol
Line-based text data: text/html (1 lines)

No.     Time           Source                Destination           Protocol Length Info                                                            Data
   4144 21.338050      18.217.1.57           192.168.38.104        HTTP     263    HTTP/1.0 200 OK  (text/html)                                    picoCTF{22e018bb8282e9d7852ed4e65f70a26524dabef78cf41e1db45c070c94621c57}

Frame 4144: 263 bytes on wire (2104 bits), 263 bytes captured (2104 bits) on interface \Device\NPF_{EE54A6A6-8BD8-498A-995A-DE0B78012FBE}, id 0
Ethernet II, Src: 02:fb:68:4c:e9:41 (02:fb:68:4c:e9:41), Dst: MS-NLB-PhysServer-32_1b:c6:1a:ae:f5 (02:3b:c6:1a:ae:f5)
Internet Protocol Version 4, Src: 18.217.1.57, Dst: 192.168.38.104
Transmission Control Protocol, Src Port: 80, Dst Port: 63701, Seq: 18, Ack: 450, Len: 209
[2 Reassembled TCP Segments (226 bytes): #4143(17), #4144(209)]
Hypertext Transfer Protocol
Line-based text data: text/html (1 lines)

No.     Time           Source                Destination           Protocol Length Info                                                            Data
   4166 21.506105      18.217.1.57           192.168.38.104        HTTP     263    HTTP/1.0 200 OK  (text/html)                                    picoCTF{40f366ccf0f6462f5b8b1dc4d7384a62aa95565afcaad96a937b8c1f1134099b}

Frame 4166: 263 bytes on wire (2104 bits), 263 bytes captured (2104 bits) on interface \Device\NPF_{EE54A6A6-8BD8-498A-995A-DE0B78012FBE}, id 0
Ethernet II, Src: 02:fb:68:4c:e9:41 (02:fb:68:4c:e9:41), Dst: MS-NLB-PhysServer-32_1b:c6:1a:ae:f5 (02:3b:c6:1a:ae:f5)
Internet Protocol Version 4, Src: 18.217.1.57, Dst: 192.168.38.104
Transmission Control Protocol, Src Port: 80, Dst Port: 63702, Seq: 18, Ack: 450, Len: 209
[2 Reassembled TCP Segments (226 bytes): #4165(17), #4166(209)]
Hypertext Transfer Protocol
Line-based text data: text/html (1 lines)

No.     Time           Source                Destination           Protocol Length Info                                                            Data
   4202 21.675061      18.217.1.57           192.168.38.104        HTTP     263    HTTP/1.0 200 OK  (text/html)                                    picoCTF{db38cbc215cde0d9cd52cbca2390defdb54303e998019a5c4ddaf9861b54efcb}

Frame 4202: 263 bytes on wire (2104 bits), 263 bytes captured (2104 bits) on interface \Device\NPF_{EE54A6A6-8BD8-498A-995A-DE0B78012FBE}, id 0
Ethernet II, Src: 02:fb:68:4c:e9:41 (02:fb:68:4c:e9:41), Dst: MS-NLB-PhysServer-32_1b:c6:1a:ae:f5 (02:3b:c6:1a:ae:f5)
Internet Protocol Version 4, Src: 18.217.1.57, Dst: 192.168.38.104
Transmission Control Protocol, Src Port: 80, Dst Port: 63703, Seq: 18, Ack: 450, Len: 209
[2 Reassembled TCP Segments (226 bytes): #4201(17), #4202(209)]
Hypertext Transfer Protocol
Line-based text data: text/html (1 lines)

No.     Time           Source                Destination           Protocol Length Info                                                            Data
   4238 21.856225      18.217.1.57           192.168.38.104        HTTP     263    HTTP/1.0 200 OK  (text/html)                                    picoCTF{090fa8ec995ab9fc9f97cbe9ea36cb81c4504a3ca02466ddd207cfe7f785cb5c}

Frame 4238: 263 bytes on wire (2104 bits), 263 bytes captured (2104 bits) on interface \Device\NPF_{EE54A6A6-8BD8-498A-995A-DE0B78012FBE}, id 0
Ethernet II, Src: 02:fb:68:4c:e9:41 (02:fb:68:4c:e9:41), Dst: MS-NLB-PhysServer-32_1b:c6:1a:ae:f5 (02:3b:c6:1a:ae:f5)
Internet Protocol Version 4, Src: 18.217.1.57, Dst: 192.168.38.104
Transmission Control Protocol, Src Port: 80, Dst Port: 63704, Seq: 18, Ack: 450, Len: 209
[2 Reassembled TCP Segments (226 bytes): #4237(17), #4238(209)]
Hypertext Transfer Protocol
Line-based text data: text/html (1 lines)

No.     Time           Source                Destination           Protocol Length Info                                                            Data
   4266 22.028442      18.217.1.57           192.168.38.104        HTTP     263    HTTP/1.0 200 OK  (text/html)                                    picoCTF{947b91a983c93217304f8e5b112e93eaf619e6a9386ab93be93a9b67e53b2fda}

Frame 4266: 263 bytes on wire (2104 bits), 263 bytes captured (2104 bits) on interface \Device\NPF_{EE54A6A6-8BD8-498A-995A-DE0B78012FBE}, id 0
Ethernet II, Src: 02:fb:68:4c:e9:41 (02:fb:68:4c:e9:41), Dst: MS-NLB-PhysServer-32_1b:c6:1a:ae:f5 (02:3b:c6:1a:ae:f5)
Internet Protocol Version 4, Src: 18.217.1.57, Dst: 192.168.38.104
Transmission Control Protocol, Src Port: 80, Dst Port: 63705, Seq: 18, Ack: 450, Len: 209
[2 Reassembled TCP Segments (226 bytes): #4265(17), #4266(209)]
Hypertext Transfer Protocol
Line-based text data: text/html (1 lines)

No.     Time           Source                Destination           Protocol Length Info                                                            Data
   4296 22.197662      18.217.1.57           192.168.38.104        HTTP     263    HTTP/1.0 200 OK  (text/html)                                    picoCTF{a3ed2f602322f749f4cb016515e25b67749efd08ac2f2c53023596cbf0dcbd0f}

Frame 4296: 263 bytes on wire (2104 bits), 263 bytes captured (2104 bits) on interface \Device\NPF_{EE54A6A6-8BD8-498A-995A-DE0B78012FBE}, id 0
Ethernet II, Src: 02:fb:68:4c:e9:41 (02:fb:68:4c:e9:41), Dst: MS-NLB-PhysServer-32_1b:c6:1a:ae:f5 (02:3b:c6:1a:ae:f5)
Internet Protocol Version 4, Src: 18.217.1.57, Dst: 192.168.38.104
Transmission Control Protocol, Src Port: 80, Dst Port: 63706, Seq: 18, Ack: 450, Len: 209
[2 Reassembled TCP Segments (226 bytes): #4295(17), #4296(209)]
Hypertext Transfer Protocol
Line-based text data: text/html (1 lines)

No.     Time           Source                Destination           Protocol Length Info                                                            Data
   4324 22.376345      18.217.1.57           192.168.38.104        HTTP     263    HTTP/1.0 200 OK  (text/html)                                    picoCTF{8e625859eb325d2a69934e4a44c93fcc132e813efb3fdaaa5143147678e9cbf9}

Frame 4324: 263 bytes on wire (2104 bits), 263 bytes captured (2104 bits) on interface \Device\NPF_{EE54A6A6-8BD8-498A-995A-DE0B78012FBE}, id 0
Ethernet II, Src: 02:fb:68:4c:e9:41 (02:fb:68:4c:e9:41), Dst: MS-NLB-PhysServer-32_1b:c6:1a:ae:f5 (02:3b:c6:1a:ae:f5)
Internet Protocol Version 4, Src: 18.217.1.57, Dst: 192.168.38.104
Transmission Control Protocol, Src Port: 80, Dst Port: 63707, Seq: 18, Ack: 450, Len: 209
[2 Reassembled TCP Segments (226 bytes): #4323(17), #4324(209)]
Hypertext Transfer Protocol
Line-based text data: text/html (1 lines)

No.     Time           Source                Destination           Protocol Length Info                                                            Data
   4370 22.536371      18.217.1.57           192.168.38.104        HTTP     263    HTTP/1.0 200 OK  (text/html)                                    picoCTF{8d43c4889ee5b507d1785adfa2592f2fb3d7cf20ebf37ce46595edc46fba3f6d}

Frame 4370: 263 bytes on wire (2104 bits), 263 bytes captured (2104 bits) on interface \Device\NPF_{EE54A6A6-8BD8-498A-995A-DE0B78012FBE}, id 0
Ethernet II, Src: 02:fb:68:4c:e9:41 (02:fb:68:4c:e9:41), Dst: MS-NLB-PhysServer-32_1b:c6:1a:ae:f5 (02:3b:c6:1a:ae:f5)
Internet Protocol Version 4, Src: 18.217.1.57, Dst: 192.168.38.104
Transmission Control Protocol, Src Port: 80, Dst Port: 63708, Seq: 18, Ack: 450, Len: 209
[2 Reassembled TCP Segments (226 bytes): #4369(17), #4370(209)]
Hypertext Transfer Protocol
Line-based text data: text/html (1 lines)

No.     Time           Source                Destination           Protocol Length Info                                                            Data
   4383 22.699322      18.217.1.57           192.168.38.104        HTTP     263    HTTP/1.0 200 OK  (text/html)                                    picoCTF{0020d021e9e38dbb5a5fa432175089d8b76e4a900618c95f8cae14fedaa45b63}

Frame 4383: 263 bytes on wire (2104 bits), 263 bytes captured (2104 bits) on interface \Device\NPF_{EE54A6A6-8BD8-498A-995A-DE0B78012FBE}, id 0
Ethernet II, Src: 02:fb:68:4c:e9:41 (02:fb:68:4c:e9:41), Dst: MS-NLB-PhysServer-32_1b:c6:1a:ae:f5 (02:3b:c6:1a:ae:f5)
Internet Protocol Version 4, Src: 18.217.1.57, Dst: 192.168.38.104
Transmission Control Protocol, Src Port: 80, Dst Port: 63711, Seq: 18, Ack: 450, Len: 209
[2 Reassembled TCP Segments (226 bytes): #4382(17), #4383(209)]
Hypertext Transfer Protocol
Line-based text data: text/html (1 lines)

No.     Time           Source                Destination           Protocol Length Info                                                            Data
   4393 22.855156      18.217.1.57           192.168.38.104        HTTP     263    HTTP/1.0 200 OK  (text/html)                                    picoCTF{69e96b10f560a6a0656a6d950e73e41bcf4226c424bb5622839dda0c66755b14}

Frame 4393: 263 bytes on wire (2104 bits), 263 bytes captured (2104 bits) on interface \Device\NPF_{EE54A6A6-8BD8-498A-995A-DE0B78012FBE}, id 0
Ethernet II, Src: 02:fb:68:4c:e9:41 (02:fb:68:4c:e9:41), Dst: MS-NLB-PhysServer-32_1b:c6:1a:ae:f5 (02:3b:c6:1a:ae:f5)
Internet Protocol Version 4, Src: 18.217.1.57, Dst: 192.168.38.104
Transmission Control Protocol, Src Port: 80, Dst Port: 63712, Seq: 18, Ack: 450, Len: 209
[2 Reassembled TCP Segments (226 bytes): #4392(17), #4393(209)]
Hypertext Transfer Protocol
Line-based text data: text/html (1 lines)

No.     Time           Source                Destination           Protocol Length Info                                                            Data
   4403 23.032820      18.217.1.57           192.168.38.104        HTTP     263    HTTP/1.0 200 OK  (text/html)                                    picoCTF{34c6ca47d858ab18aa2008f4ac31c31570c46186939e6b46458b19082122d4bd}

Frame 4403: 263 bytes on wire (2104 bits), 263 bytes captured (2104 bits) on interface \Device\NPF_{EE54A6A6-8BD8-498A-995A-DE0B78012FBE}, id 0
Ethernet II, Src: 02:fb:68:4c:e9:41 (02:fb:68:4c:e9:41), Dst: MS-NLB-PhysServer-32_1b:c6:1a:ae:f5 (02:3b:c6:1a:ae:f5)
Internet Protocol Version 4, Src: 18.217.1.57, Dst: 192.168.38.104
Transmission Control Protocol, Src Port: 80, Dst Port: 63713, Seq: 18, Ack: 450, Len: 209
[2 Reassembled TCP Segments (226 bytes): #4402(17), #4403(209)]
Hypertext Transfer Protocol
Line-based text data: text/html (1 lines)

No.     Time           Source                Destination           Protocol Length Info                                                            Data
   4413 23.200501      18.217.1.57           192.168.38.104        HTTP     263    HTTP/1.0 200 OK  (text/html)                                    picoCTF{ebfcebe696b1fdbba2abb3b003165152456bd83b6ddfbf180ca366de0dec1b0c}

Frame 4413: 263 bytes on wire (2104 bits), 263 bytes captured (2104 bits) on interface \Device\NPF_{EE54A6A6-8BD8-498A-995A-DE0B78012FBE}, id 0
Ethernet II, Src: 02:fb:68:4c:e9:41 (02:fb:68:4c:e9:41), Dst: MS-NLB-PhysServer-32_1b:c6:1a:ae:f5 (02:3b:c6:1a:ae:f5)
Internet Protocol Version 4, Src: 18.217.1.57, Dst: 192.168.38.104
Transmission Control Protocol, Src Port: 80, Dst Port: 63714, Seq: 18, Ack: 450, Len: 209
[2 Reassembled TCP Segments (226 bytes): #4412(17), #4413(209)]
Hypertext Transfer Protocol
Line-based text data: text/html (1 lines)

No.     Time           Source                Destination           Protocol Length Info                                                            Data
   4424 23.369390      18.217.1.57           192.168.38.104        HTTP     263    HTTP/1.0 200 OK  (text/html)                                    picoCTF{aa125aaeb4723f69dceaa90125a8099a6f3fe0259e068fd82dcbeb76131448bb}

Frame 4424: 263 bytes on wire (2104 bits), 263 bytes captured (2104 bits) on interface \Device\NPF_{EE54A6A6-8BD8-498A-995A-DE0B78012FBE}, id 0
Ethernet II, Src: 02:fb:68:4c:e9:41 (02:fb:68:4c:e9:41), Dst: MS-NLB-PhysServer-32_1b:c6:1a:ae:f5 (02:3b:c6:1a:ae:f5)
Internet Protocol Version 4, Src: 18.217.1.57, Dst: 192.168.38.104
Transmission Control Protocol, Src Port: 80, Dst Port: 63715, Seq: 18, Ack: 450, Len: 209
[2 Reassembled TCP Segments (226 bytes): #4423(17), #4424(209)]
Hypertext Transfer Protocol
Line-based text data: text/html (1 lines)

No.     Time           Source                Destination           Protocol Length Info                                                            Data
   4435 23.546859      18.217.1.57           192.168.38.104        HTTP     263    HTTP/1.0 200 OK  (text/html)                                    picoCTF{80d65857d8d81a92769e8cd136376522d113c4298b331318ce7adcbf5e70104d}

Frame 4435: 263 bytes on wire (2104 bits), 263 bytes captured (2104 bits) on interface \Device\NPF_{EE54A6A6-8BD8-498A-995A-DE0B78012FBE}, id 0
Ethernet II, Src: 02:fb:68:4c:e9:41 (02:fb:68:4c:e9:41), Dst: MS-NLB-PhysServer-32_1b:c6:1a:ae:f5 (02:3b:c6:1a:ae:f5)
Internet Protocol Version 4, Src: 18.217.1.57, Dst: 192.168.38.104
Transmission Control Protocol, Src Port: 80, Dst Port: 63716, Seq: 18, Ack: 450, Len: 209
[2 Reassembled TCP Segments (226 bytes): #4434(17), #4435(209)]
Hypertext Transfer Protocol
Line-based text data: text/html (1 lines)

No.     Time           Source                Destination           Protocol Length Info                                                            Data
   4451 23.717039      18.217.1.57           192.168.38.104        HTTP     263    HTTP/1.0 200 OK  (text/html)                                    picoCTF{00ae773ce4a4b3cf3287f072c13ec7139a74207de635de9d115087bc4f312bae}

Frame 4451: 263 bytes on wire (2104 bits), 263 bytes captured (2104 bits) on interface \Device\NPF_{EE54A6A6-8BD8-498A-995A-DE0B78012FBE}, id 0
Ethernet II, Src: 02:fb:68:4c:e9:41 (02:fb:68:4c:e9:41), Dst: MS-NLB-PhysServer-32_1b:c6:1a:ae:f5 (02:3b:c6:1a:ae:f5)
Internet Protocol Version 4, Src: 18.217.1.57, Dst: 192.168.38.104
Transmission Control Protocol, Src Port: 80, Dst Port: 63717, Seq: 18, Ack: 450, Len: 209
[2 Reassembled TCP Segments (226 bytes): #4450(17), #4451(209)]
Hypertext Transfer Protocol
Line-based text data: text/html (1 lines)

No.     Time           Source                Destination           Protocol Length Info                                                            Data
   4461 23.889449      18.217.1.57           192.168.38.104        HTTP     263    HTTP/1.0 200 OK  (text/html)                                    picoCTF{7e808778b7250893922a17d53f10365b009a7624935850ac5c8140461e49d579}

Frame 4461: 263 bytes on wire (2104 bits), 263 bytes captured (2104 bits) on interface \Device\NPF_{EE54A6A6-8BD8-498A-995A-DE0B78012FBE}, id 0
Ethernet II, Src: 02:fb:68:4c:e9:41 (02:fb:68:4c:e9:41), Dst: MS-NLB-PhysServer-32_1b:c6:1a:ae:f5 (02:3b:c6:1a:ae:f5)
Internet Protocol Version 4, Src: 18.217.1.57, Dst: 192.168.38.104
Transmission Control Protocol, Src Port: 80, Dst Port: 63718, Seq: 18, Ack: 450, Len: 209
[2 Reassembled TCP Segments (226 bytes): #4460(17), #4461(209)]
Hypertext Transfer Protocol
Line-based text data: text/html (1 lines)

No.     Time           Source                Destination           Protocol Length Info                                                            Data
   4471 24.066979      18.217.1.57           192.168.38.104        HTTP     263    HTTP/1.0 200 OK  (text/html)                                    picoCTF{33e80d6e9f56c1f7705c73566d347ccb32b4662171f224b6dfcb6c8fce4f1601}

Frame 4471: 263 bytes on wire (2104 bits), 263 bytes captured (2104 bits) on interface \Device\NPF_{EE54A6A6-8BD8-498A-995A-DE0B78012FBE}, id 0
Ethernet II, Src: 02:fb:68:4c:e9:41 (02:fb:68:4c:e9:41), Dst: MS-NLB-PhysServer-32_1b:c6:1a:ae:f5 (02:3b:c6:1a:ae:f5)
Internet Protocol Version 4, Src: 18.217.1.57, Dst: 192.168.38.104
Transmission Control Protocol, Src Port: 80, Dst Port: 63719, Seq: 18, Ack: 450, Len: 209
[2 Reassembled TCP Segments (226 bytes): #4470(17), #4471(209)]
Hypertext Transfer Protocol
Line-based text data: text/html (1 lines)

No.     Time           Source                Destination           Protocol Length Info                                                            Data
   4481 24.234587      18.217.1.57           192.168.38.104        HTTP     263    HTTP/1.0 200 OK  (text/html)                                    picoCTF{5d921ffbe2709ba82d09603a095530aedae41ab96fd052140cbc64319b7ab0ac}

Frame 4481: 263 bytes on wire (2104 bits), 263 bytes captured (2104 bits) on interface \Device\NPF_{EE54A6A6-8BD8-498A-995A-DE0B78012FBE}, id 0
Ethernet II, Src: 02:fb:68:4c:e9:41 (02:fb:68:4c:e9:41), Dst: MS-NLB-PhysServer-32_1b:c6:1a:ae:f5 (02:3b:c6:1a:ae:f5)
Internet Protocol Version 4, Src: 18.217.1.57, Dst: 192.168.38.104
Transmission Control Protocol, Src Port: 80, Dst Port: 63720, Seq: 18, Ack: 450, Len: 209
[2 Reassembled TCP Segments (226 bytes): #4480(17), #4481(209)]
Hypertext Transfer Protocol
Line-based text data: text/html (1 lines)

No.     Time           Source                Destination           Protocol Length Info                                                            Data
   4491 24.433976      18.217.1.57           192.168.38.104        HTTP     263    HTTP/1.0 200 OK  (text/html)                                    picoCTF{977b385d5dd6abde9cb89ee940b5cfb7179d73d989c6993346d278bff003c154}

Frame 4491: 263 bytes on wire (2104 bits), 263 bytes captured (2104 bits) on interface \Device\NPF_{EE54A6A6-8BD8-498A-995A-DE0B78012FBE}, id 0
Ethernet II, Src: 02:fb:68:4c:e9:41 (02:fb:68:4c:e9:41), Dst: MS-NLB-PhysServer-32_1b:c6:1a:ae:f5 (02:3b:c6:1a:ae:f5)
Internet Protocol Version 4, Src: 18.217.1.57, Dst: 192.168.38.104
Transmission Control Protocol, Src Port: 80, Dst Port: 63721, Seq: 18, Ack: 450, Len: 209
[2 Reassembled TCP Segments (226 bytes): #4490(17), #4491(209)]
Hypertext Transfer Protocol
Line-based text data: text/html (1 lines)

No.     Time           Source                Destination           Protocol Length Info                                                            Data
   4501 24.610231      18.217.1.57           192.168.38.104        HTTP     263    HTTP/1.0 200 OK  (text/html)                                    picoCTF{ca7d3b029817de8f318d8fa521ad1b569f4e8a37358373193522cc7f5628ed49}

Frame 4501: 263 bytes on wire (2104 bits), 263 bytes captured (2104 bits) on interface \Device\NPF_{EE54A6A6-8BD8-498A-995A-DE0B78012FBE}, id 0
Ethernet II, Src: 02:fb:68:4c:e9:41 (02:fb:68:4c:e9:41), Dst: MS-NLB-PhysServer-32_1b:c6:1a:ae:f5 (02:3b:c6:1a:ae:f5)
Internet Protocol Version 4, Src: 18.217.1.57, Dst: 192.168.38.104
Transmission Control Protocol, Src Port: 80, Dst Port: 63722, Seq: 18, Ack: 450, Len: 209
[2 Reassembled TCP Segments (226 bytes): #4500(17), #4501(209)]
Hypertext Transfer Protocol
Line-based text data: text/html (1 lines)

No.     Time           Source                Destination           Protocol Length Info                                                            Data
   4511 24.806786      18.217.1.57           192.168.38.104        HTTP     263    HTTP/1.0 200 OK  (text/html)                                    picoCTF{a820680ab6444b1daf5281192f337aefb4aa95a313c9f270804ef7826ecc298c}

Frame 4511: 263 bytes on wire (2104 bits), 263 bytes captured (2104 bits) on interface \Device\NPF_{EE54A6A6-8BD8-498A-995A-DE0B78012FBE}, id 0
Ethernet II, Src: 02:fb:68:4c:e9:41 (02:fb:68:4c:e9:41), Dst: MS-NLB-PhysServer-32_1b:c6:1a:ae:f5 (02:3b:c6:1a:ae:f5)
Internet Protocol Version 4, Src: 18.217.1.57, Dst: 192.168.38.104
Transmission Control Protocol, Src Port: 80, Dst Port: 63723, Seq: 18, Ack: 450, Len: 209
[2 Reassembled TCP Segments (226 bytes): #4510(17), #4511(209)]
Hypertext Transfer Protocol
Line-based text data: text/html (1 lines)

No.     Time           Source                Destination           Protocol Length Info                                                            Data
   4521 24.984278      18.217.1.57           192.168.38.104        HTTP     263    HTTP/1.0 200 OK  (text/html)                                    picoCTF{998d01dadf1b44eb4ec7b7e8fa11f11bcd2d7d86f3f9e4966dde22d4a84ca113}

Frame 4521: 263 bytes on wire (2104 bits), 263 bytes captured (2104 bits) on interface \Device\NPF_{EE54A6A6-8BD8-498A-995A-DE0B78012FBE}, id 0
Ethernet II, Src: 02:fb:68:4c:e9:41 (02:fb:68:4c:e9:41), Dst: MS-NLB-PhysServer-32_1b:c6:1a:ae:f5 (02:3b:c6:1a:ae:f5)
Internet Protocol Version 4, Src: 18.217.1.57, Dst: 192.168.38.104
Transmission Control Protocol, Src Port: 80, Dst Port: 63724, Seq: 18, Ack: 450, Len: 209
[2 Reassembled TCP Segments (226 bytes): #4520(17), #4521(209)]
Hypertext Transfer Protocol
Line-based text data: text/html (1 lines)

No.     Time           Source                Destination           Protocol Length Info                                                            Data
   4531 25.159410      18.217.1.57           192.168.38.104        HTTP     263    HTTP/1.0 200 OK  (text/html)                                    picoCTF{cb8fe3ec65f890e2f0570c98c4edd3fe4115bc059ac2afb39300c7b66f2302c4}

Frame 4531: 263 bytes on wire (2104 bits), 263 bytes captured (2104 bits) on interface \Device\NPF_{EE54A6A6-8BD8-498A-995A-DE0B78012FBE}, id 0
Ethernet II, Src: 02:fb:68:4c:e9:41 (02:fb:68:4c:e9:41), Dst: MS-NLB-PhysServer-32_1b:c6:1a:ae:f5 (02:3b:c6:1a:ae:f5)
Internet Protocol Version 4, Src: 18.217.1.57, Dst: 192.168.38.104
Transmission Control Protocol, Src Port: 80, Dst Port: 63725, Seq: 18, Ack: 450, Len: 209
[2 Reassembled TCP Segments (226 bytes): #4530(17), #4531(209)]
Hypertext Transfer Protocol
Line-based text data: text/html (1 lines)

No.     Time           Source                Destination           Protocol Length Info                                                            Data
   4541 25.332729      18.217.1.57           192.168.38.104        HTTP     263    HTTP/1.0 200 OK  (text/html)                                    picoCTF{bc2af8cbe0ae0befdd28b14412295243354cd3c7cc74e88d8facb2fd5e6ef34d}

Frame 4541: 263 bytes on wire (2104 bits), 263 bytes captured (2104 bits) on interface \Device\NPF_{EE54A6A6-8BD8-498A-995A-DE0B78012FBE}, id 0
Ethernet II, Src: 02:fb:68:4c:e9:41 (02:fb:68:4c:e9:41), Dst: MS-NLB-PhysServer-32_1b:c6:1a:ae:f5 (02:3b:c6:1a:ae:f5)
Internet Protocol Version 4, Src: 18.217.1.57, Dst: 192.168.38.104
Transmission Control Protocol, Src Port: 80, Dst Port: 63726, Seq: 18, Ack: 450, Len: 209
[2 Reassembled TCP Segments (226 bytes): #4540(17), #4541(209)]
Hypertext Transfer Protocol
Line-based text data: text/html (1 lines)

No.     Time           Source                Destination           Protocol Length Info                                                            Data
   4551 25.506210      18.217.1.57           192.168.38.104        HTTP     263    HTTP/1.0 200 OK  (text/html)                                    picoCTF{09082a0313e16fc36f8076ff86e54e83048a8568f5c2294fea5fb3bcd212e7f2}

Frame 4551: 263 bytes on wire (2104 bits), 263 bytes captured (2104 bits) on interface \Device\NPF_{EE54A6A6-8BD8-498A-995A-DE0B78012FBE}, id 0
Ethernet II, Src: 02:fb:68:4c:e9:41 (02:fb:68:4c:e9:41), Dst: MS-NLB-PhysServer-32_1b:c6:1a:ae:f5 (02:3b:c6:1a:ae:f5)
Internet Protocol Version 4, Src: 18.217.1.57, Dst: 192.168.38.104
Transmission Control Protocol, Src Port: 80, Dst Port: 63727, Seq: 18, Ack: 450, Len: 209
[2 Reassembled TCP Segments (226 bytes): #4550(17), #4551(209)]
Hypertext Transfer Protocol
Line-based text data: text/html (1 lines)

No.     Time           Source                Destination           Protocol Length Info                                                            Data
   4561 25.701979      18.217.1.57           192.168.38.104        HTTP     263    HTTP/1.0 200 OK  (text/html)                                    picoCTF{2386746aeb258914349dc81a85cb5de72e47930c7f11759b4ad9f864efa7b5aa}

Frame 4561: 263 bytes on wire (2104 bits), 263 bytes captured (2104 bits) on interface \Device\NPF_{EE54A6A6-8BD8-498A-995A-DE0B78012FBE}, id 0
Ethernet II, Src: 02:fb:68:4c:e9:41 (02:fb:68:4c:e9:41), Dst: MS-NLB-PhysServer-32_1b:c6:1a:ae:f5 (02:3b:c6:1a:ae:f5)
Internet Protocol Version 4, Src: 18.217.1.57, Dst: 192.168.38.104
Transmission Control Protocol, Src Port: 80, Dst Port: 63728, Seq: 18, Ack: 450, Len: 209
[2 Reassembled TCP Segments (226 bytes): #4560(17), #4561(209)]
Hypertext Transfer Protocol
Line-based text data: text/html (1 lines)

No.     Time           Source                Destination           Protocol Length Info                                                            Data
   4571 25.877310      18.217.1.57           192.168.38.104        HTTP     263    HTTP/1.0 200 OK  (text/html)                                    picoCTF{173306d7b886423d9f79d3d0d05209807ae7b83c445931319830e4e0ad2d2f09}

Frame 4571: 263 bytes on wire (2104 bits), 263 bytes captured (2104 bits) on interface \Device\NPF_{EE54A6A6-8BD8-498A-995A-DE0B78012FBE}, id 0
Ethernet II, Src: 02:fb:68:4c:e9:41 (02:fb:68:4c:e9:41), Dst: MS-NLB-PhysServer-32_1b:c6:1a:ae:f5 (02:3b:c6:1a:ae:f5)
Internet Protocol Version 4, Src: 18.217.1.57, Dst: 192.168.38.104
Transmission Control Protocol, Src Port: 80, Dst Port: 63729, Seq: 18, Ack: 450, Len: 209
[2 Reassembled TCP Segments (226 bytes): #4570(17), #4571(209)]
Hypertext Transfer Protocol
Line-based text data: text/html (1 lines)

No.     Time           Source                Destination           Protocol Length Info                                                            Data
   4581 26.087564      18.217.1.57           192.168.38.104        HTTP     263    HTTP/1.0 200 OK  (text/html)                                    picoCTF{6cb98e2295bbe1f15fd8b8b5908de360d386b98a0ce7e0407e001b453b05be22}

Frame 4581: 263 bytes on wire (2104 bits), 263 bytes captured (2104 bits) on interface \Device\NPF_{EE54A6A6-8BD8-498A-995A-DE0B78012FBE}, id 0
Ethernet II, Src: 02:fb:68:4c:e9:41 (02:fb:68:4c:e9:41), Dst: MS-NLB-PhysServer-32_1b:c6:1a:ae:f5 (02:3b:c6:1a:ae:f5)
Internet Protocol Version 4, Src: 18.217.1.57, Dst: 192.168.38.104
Transmission Control Protocol, Src Port: 80, Dst Port: 63730, Seq: 18, Ack: 450, Len: 209
[2 Reassembled TCP Segments (226 bytes): #4580(17), #4581(209)]
Hypertext Transfer Protocol
Line-based text data: text/html (1 lines)

No.     Time           Source                Destination           Protocol Length Info                                                            Data
   4591 26.283249      18.217.1.57           192.168.38.104        HTTP     263    HTTP/1.0 200 OK  (text/html)                                    picoCTF{132e643c8fdadb54c366072cb33940411fcfd355209fc1ce9b2022ad1cd1b060}

Frame 4591: 263 bytes on wire (2104 bits), 263 bytes captured (2104 bits) on interface \Device\NPF_{EE54A6A6-8BD8-498A-995A-DE0B78012FBE}, id 0
Ethernet II, Src: 02:fb:68:4c:e9:41 (02:fb:68:4c:e9:41), Dst: MS-NLB-PhysServer-32_1b:c6:1a:ae:f5 (02:3b:c6:1a:ae:f5)
Internet Protocol Version 4, Src: 18.217.1.57, Dst: 192.168.38.104
Transmission Control Protocol, Src Port: 80, Dst Port: 63731, Seq: 18, Ack: 450, Len: 209
[2 Reassembled TCP Segments (226 bytes): #4590(17), #4591(209)]
Hypertext Transfer Protocol
Line-based text data: text/html (1 lines)

No.     Time           Source                Destination           Protocol Length Info                                                            Data
   4601 26.449432      18.217.1.57           192.168.38.104        HTTP     263    HTTP/1.0 200 OK  (text/html)                                    picoCTF{044ffca72f0f191b0715ff1a9bff182c810cb2786370cbf8cdc1943c2e7aedf6}

Frame 4601: 263 bytes on wire (2104 bits), 263 bytes captured (2104 bits) on interface \Device\NPF_{EE54A6A6-8BD8-498A-995A-DE0B78012FBE}, id 0
Ethernet II, Src: 02:fb:68:4c:e9:41 (02:fb:68:4c:e9:41), Dst: MS-NLB-PhysServer-32_1b:c6:1a:ae:f5 (02:3b:c6:1a:ae:f5)
Internet Protocol Version 4, Src: 18.217.1.57, Dst: 192.168.38.104
Transmission Control Protocol, Src Port: 80, Dst Port: 63732, Seq: 18, Ack: 450, Len: 209
[2 Reassembled TCP Segments (226 bytes): #4600(17), #4601(209)]
Hypertext Transfer Protocol
Line-based text data: text/html (1 lines)

No.     Time           Source                Destination           Protocol Length Info                                                            Data
   4611 26.628858      18.217.1.57           192.168.38.104        HTTP     263    HTTP/1.0 200 OK  (text/html)                                    picoCTF{b278104c2602442e3db401749c30527d80ba560f9a02c939cb4ff6ea189a140d}

Frame 4611: 263 bytes on wire (2104 bits), 263 bytes captured (2104 bits) on interface \Device\NPF_{EE54A6A6-8BD8-498A-995A-DE0B78012FBE}, id 0
Ethernet II, Src: 02:fb:68:4c:e9:41 (02:fb:68:4c:e9:41), Dst: MS-NLB-PhysServer-32_1b:c6:1a:ae:f5 (02:3b:c6:1a:ae:f5)
Internet Protocol Version 4, Src: 18.217.1.57, Dst: 192.168.38.104
Transmission Control Protocol, Src Port: 80, Dst Port: 63733, Seq: 18, Ack: 450, Len: 209
[2 Reassembled TCP Segments (226 bytes): #4610(17), #4611(209)]
Hypertext Transfer Protocol
Line-based text data: text/html (1 lines)

No.     Time           Source                Destination           Protocol Length Info                                                            Data
   4621 26.804953      18.217.1.57           192.168.38.104        HTTP     263    HTTP/1.0 200 OK  (text/html)                                    picoCTF{7282e048d6d32383b65f3a03b1101219ac73f7f538446b78d1b2b334e0985447}

Frame 4621: 263 bytes on wire (2104 bits), 263 bytes captured (2104 bits) on interface \Device\NPF_{EE54A6A6-8BD8-498A-995A-DE0B78012FBE}, id 0
Ethernet II, Src: 02:fb:68:4c:e9:41 (02:fb:68:4c:e9:41), Dst: MS-NLB-PhysServer-32_1b:c6:1a:ae:f5 (02:3b:c6:1a:ae:f5)
Internet Protocol Version 4, Src: 18.217.1.57, Dst: 192.168.38.104
Transmission Control Protocol, Src Port: 80, Dst Port: 63734, Seq: 18, Ack: 450, Len: 209
[2 Reassembled TCP Segments (226 bytes): #4620(17), #4621(209)]
Hypertext Transfer Protocol
Line-based text data: text/html (1 lines)

No.     Time           Source                Destination           Protocol Length Info                                                            Data
   4631 26.979783      18.217.1.57           192.168.38.104        HTTP     263    HTTP/1.0 200 OK  (text/html)                                    picoCTF{98406c4acbf0f57b3ccbc923aab5a603d70f86d507f422d9bd8656398f53433e}

Frame 4631: 263 bytes on wire (2104 bits), 263 bytes captured (2104 bits) on interface \Device\NPF_{EE54A6A6-8BD8-498A-995A-DE0B78012FBE}, id 0
Ethernet II, Src: 02:fb:68:4c:e9:41 (02:fb:68:4c:e9:41), Dst: MS-NLB-PhysServer-32_1b:c6:1a:ae:f5 (02:3b:c6:1a:ae:f5)
Internet Protocol Version 4, Src: 18.217.1.57, Dst: 192.168.38.104
Transmission Control Protocol, Src Port: 80, Dst Port: 63735, Seq: 18, Ack: 450, Len: 209
[2 Reassembled TCP Segments (226 bytes): #4630(17), #4631(209)]
Hypertext Transfer Protocol
Line-based text data: text/html (1 lines)

No.     Time           Source                Destination           Protocol Length Info                                                            Data
   4641 27.138818      18.217.1.57           192.168.38.104        HTTP     263    HTTP/1.0 200 OK  (text/html)                                    picoCTF{3fe0b2788f30d9cb9f77d3b2752f13c554fe7f0e7a2883e57c8a44b34f35675c}

Frame 4641: 263 bytes on wire (2104 bits), 263 bytes captured (2104 bits) on interface \Device\NPF_{EE54A6A6-8BD8-498A-995A-DE0B78012FBE}, id 0
Ethernet II, Src: 02:fb:68:4c:e9:41 (02:fb:68:4c:e9:41), Dst: MS-NLB-PhysServer-32_1b:c6:1a:ae:f5 (02:3b:c6:1a:ae:f5)
Internet Protocol Version 4, Src: 18.217.1.57, Dst: 192.168.38.104
Transmission Control Protocol, Src Port: 80, Dst Port: 63736, Seq: 18, Ack: 450, Len: 209
[2 Reassembled TCP Segments (226 bytes): #4640(17), #4641(209)]
Hypertext Transfer Protocol
Line-based text data: text/html (1 lines)
